{
  "schema_version": "1.0.0",
  "type": "article",
  "id": "https://example.com/blog/static-blueprint",
  "source_url": "https://example.com/blog/static-blueprint",
  "title": "Static LLM Page Example",
  "language": "en",
  "summary": "A static .llm.json example for SSG delivery.",
  "tags": ["example", "static"],
  "last_modified": "2025-08-25T10:00:00Z",
  "content_version": "1.0.0",
  "page_checksum": "staticeXamplechecksum1234567890abcdefghijklmnopqrstuvwxyz==",
  "license": "CC-BY-4.0",
  "publisher": { "name": "Example Publisher", "url": "https://example.com" },
  "content": {
    "authors": [{ "name": "Demo" }],
    "published_at": "2025-08-25T09:00:00Z",
    "updated_at": "2025-08-25T10:00:00Z",
    "sections": [{ "heading": "Intro", "content": "This is a static example." }],
    "body": "This payload is served as /blog/static-blueprint.llm.json."
  }
}

